"module","modSize","bkgrModSize","rank","enrichmentP","BonferoniP","nModGenesInTerm","fracOfBkgrModSize","fracOfBkgrTermSize","bkgrTermSize","termID","termOntology","termName","termDefinition"
"salmon",78,78,10,2.24100281143763e-12,4.19627776441696e-08,10,0.128205128205128,0.588235294117647,17,"GO:0006695","BP","cholesterol biosynthetic process","The chemical reactions and pathways resulting in the formation of cholesterol, cholest-5-en-3 beta-ol, the principal sterol of vertebrates and the precursor of many steroids, including bile acids and steroid hormones."
"tan",81,74,1,0.000105138291062786,1,39,0.527027027027027,0.0434782608695652,897,"GO:0003824","MF","catalytic activity","Catalysis of a biochemical reaction at physiological temperatures. In biologically catalyzed reactions, the reactants are known as substrates, and the catalysts are naturally occurring macromolecular substances known as enzymes. Enzymes possess specific binding sites for substrates, and are usually composed wholly or largely of protein, but RNA that has catalytic activity (ribozyme) is often also regarded as enzymatic."
"tan",81,74,2,0.00178167743258299,1,3,0.0405405405405405,0.3,10,"GO:0030134","CC","COPII-coated ER to Golgi transport vesicle","A vesicle with a coat formed of the COPII coat complex proteins. The COPII coat complex is formed by the Sec23p/Sec24p and the Sec13p/Sec31p heterodimers. COPII-associated vesicles transport proteins from the rough endoplasmic reticulum to the Golgi apparatus (anterograde transport)."
"tan",81,74,3,0.00180145350344058,1,16,0.216216216216216,0.0569395017793594,281,"GO:0005794","CC","Golgi apparatus","A membrane-bound cytoplasmic organelle of the endomembrane system that further processes the core oligosaccharides (e.g. N-glycans) added to proteins in the endoplasmic reticulum and packages them into membrane-bound vesicles. The Golgi apparatus operates at the intersection of the secretory, lysosomal, and endocytic pathways."
"tan",81,74,4,0.00197185330759799,1,2,0.027027027027027,0.666666666666667,3,"GO:0048490","BP","anterograde synaptic vesicle transport","The directed movement of synaptic vesicle along axonal microtubules from the cell body to the presynapse."
"tan",81,74,5,0.00206294809358708,1,12,0.162162162162162,0.0662983425414365,181,"GO:1902494","CC","catalytic complex",NA
"tan",81,74,6,0.00216867376460692,1,4,0.0540540540540541,0.181818181818182,22,"GO:0071453","BP","cellular response to oxygen levels","Any process that results in a change in state or activity of a cell (in terms of movement, secretion, enzyme production, gene expression, etc.) as a result of a stimulus reflecting the presence, absence, or concentration of oxygen."
"tan",81,74,7,0.00292075175846576,1,13,0.175675675675676,0.0607476635514019,214,"GO:0046907","BP","intracellular transport","The directed movement of substances within a cell."
"tan",81,74,8,0.00314598334583815,1,3,0.0405405405405405,0.25,12,"GO:0032365","BP","intracellular lipid transport","The directed movement of lipids within cells."
"tan",81,74,9,0.00371970437486703,1,30,0.405405405405405,0.0407608695652174,736,"GO:0012505","CC","endomembrane system","A collection of membranous structures involved in transport within the cell. The main components of the endomembrane system are endoplasmic reticulum, Golgi bodies, vesicles, cell membrane and nuclear envelope. Members of the endomembrane system pass materials through each other or though the use of vesicles."
"tan",81,74,10,0.00376211828046461,1,5,0.0675675675675676,0.121951219512195,41,"GO:0005802","CC","trans-Golgi network","The network of interconnected tubular and cisternal structures located within the Golgi apparatus on the side distal to the endoplasmic reticulum, from which secretory vesicles emerge. The trans-Golgi network is important in the later stages of protein secretion where it is thought to play a key role in the sorting and targeting of secreted proteins to the correct destination."
"turquoise",529,506,1,0.000143740301068431,1,9,0.0177865612648221,0.642857142857143,14,"GO:0000956","BP","nuclear-transcribed mRNA catabolic process","The chemical reactions and pathways resulting in the breakdown of nuclear-transcribed mRNAs in eukaryotic cells."
"turquoise",529,506,2,0.000180631303060313,1,37,0.0731225296442688,0.313559322033898,118,"GO:0008134","MF","transcription factor binding","Binding to a transcription factor, a protein required to initiate or regulate transcription."
"turquoise",529,506,3,0.000225125258381369,1,25,0.0494071146245059,0.357142857142857,70,"GO:0003712","MF","transcription coregulator activity","A transcription regulator activity that modulates the transcription of specific gene sets via binding to a DNA-bound DNA-binding transcription factor, either on its own or as part of a complex. Coregulators often act by altering chromatin structure and modifications. For example, one class of transcription coregulators modifies chromatin structure through covalent modification of histones. A second class remodels the conformation of chromatin in an ATP-dependent fashion. A third class modulates interactions of DNA-bound DNA-binding transcription factors with other transcription coregulators."
"turquoise",529,506,4,0.000270150061097791,1,72,0.142292490118577,0.258064516129032,279,"GO:0010557","BP","positive regulation of macromolecule biosynthetic process","Any process that increases the rate, frequency or extent of the chemical reactions and pathways resulting in the formation of a macromolecule, any molecule of high relative molecular mass, the structure of which essentially comprises the multiple repetition of units derived, actually or conceptually, from molecules of low relative molecular mass."
"turquoise",529,506,5,0.000309795292764757,1,15,0.0296442687747036,0.441176470588235,34,"GO:0007606","BP","sensory perception of chemical stimulus","The series of events required for an organism to receive a sensory chemical stimulus, convert it to a molecular signal, and recognize and characterize the signal. This is a neurological process."
"turquoise",529,506,6,0.000376796993517764,1,64,0.126482213438735,0.262295081967213,244,"GO:0045893","BP","positive regulation of transcription, DNA-templated","Any process that activates or increases the frequency, rate or extent of cellular DNA-templated transcription."
"turquoise",529,506,7,0.000376796993517764,1,64,0.126482213438735,0.262295081967213,244,"GO:1902680","BP","positive regulation of RNA biosynthetic process",NA
"turquoise",529,506,8,0.000376796993517764,1,64,0.126482213438735,0.262295081967213,244,"GO:1903508","BP","positive regulation of nucleic acid-templated transcription",NA
"turquoise",529,506,9,0.000426560759610784,1,13,0.0256916996047431,0.464285714285714,28,"GO:0007608","BP","sensory perception of smell","The series of events required for an organism to receive an olfactory stimulus, convert it to a molecular signal, and recognize and characterize the signal. Olfaction involves the detection of chemical composition of an organism's ambient medium by chemoreceptors. This is a neurological process."
"turquoise",529,506,10,0.000479994401393481,1,228,0.450592885375494,0.208600182982617,1093,"GO:0044260","BP","cellular macromolecule metabolic process","The chemical reactions and pathways involving macromolecules, any molecule of high relative molecular mass, the structure of which essentially comprises the multiple repetition of units derived, actually or conceptually, from molecules of low relative molecular mass, as carried out by individual cells."
"yellow",199,143,1,0.000108576995230805,1,5,0.034965034965035,0.454545454545455,11,"GO:0030666","CC","endocytic vesicle membrane","The lipid bilayer surrounding an endocytic vesicle."
"yellow",199,143,2,0.00012473011636114,1,3,0.020979020979021,1,3,"GO:0016151","MF","nickel cation binding","Binding to a nickel (Ni) cation."
"yellow",199,143,3,0.000178632049510594,1,5,0.034965034965035,0.416666666666667,12,"GO:0006900","BP","vesicle budding from membrane","The evagination of a membrane, resulting in formation of a vesicle."
"yellow",199,143,4,0.00036695968046832,1,4,0.027972027972028,0.5,8,"GO:0003156","BP","regulation of animal organ formation","Any process that modulates the rate, frequency or extent of animal organ formation. Organ formation is the process pertaining to the initial formation of an organ from unspecified parts. The process begins with the specific processes that contribute to the appearance of the discrete structure, such as inductive events, and ends when the structural rudiment of the organ is recognizable, such as a condensation of mesenchymal cells into the organ rudiment."
"yellow",199,143,5,0.00115687741388462,1,3,0.020979020979021,0.6,5,"GO:0019883","BP","antigen processing and presentation of endogenous antigen","The process in which an antigen-presenting cell expresses antigen (peptide or lipid) of endogenous origin on its cell surface in association with an MHC protein complex."
"yellow",199,143,6,0.00115687741388462,1,3,0.020979020979021,0.6,5,"GO:0019885","BP","antigen processing and presentation of endogenous peptide antigen via MHC class I","The process in which an antigen-presenting cell expresses a peptide antigen of endogenous origin on its cell surface in association with an MHC class I protein complex. The peptide antigen is typically, but not always, processed from a whole protein. Class I here refers to classical class I molecules."
"yellow",199,143,7,0.00158746676664781,1,10,0.0699300699300699,0.149253731343284,67,"GO:0005996","BP","monosaccharide metabolic process","The chemical reactions and pathways involving monosaccharides, the simplest carbohydrates. They are polyhydric alcohols containing either an aldehyde or a keto group and between three to ten or more carbon atoms. They form the constitutional repeating units of oligo- and polysaccharides."
"yellow",199,143,8,0.00222860349053446,1,3,0.020979020979021,0.5,6,"GO:0001759","BP","organ induction","The interaction of two or more cells or tissues that causes them to change their fates and specify the development of an organ."
"yellow",199,143,9,0.00222860349053446,1,3,0.020979020979021,0.5,6,"GO:0048821","BP","erythrocyte development","The process whose specific outcome is the progression of an erythrocyte over time, from its formation to the mature structure."
"yellow",199,143,10,0.00238380128122499,1,7,0.048951048951049,0.184210526315789,38,"GO:0051054","BP","positive regulation of DNA metabolic process","Any process that activates or increases the frequency, rate or extent of the chemical reactions and pathways involving DNA."
